{
  "$schema": "./schema.json",
  "spec": "0036-property-registry",
  "entity": "Dataset",
  "formIdEnum": "DatasetItem",
  "formIdOrder": [
    "Title",
    "Index",
    "Units",
    "Widget",
    "Fft",
    "Waterfall",
    "WaterfallYAxis",
    "Led",
    "LedHigh",
    "Plt",
    "FftMin",
    "FftMax",
    "PltMin",
    "PltMax",
    "WgtMin",
    "WgtMax",
    "FftSamples",
    "FftSamplingRate",
    "FftWindow",
    "XAxis",
    "OverviewDisplay",
    "HideOnDashboard",
    "TransformCode",
    "Virtual",
    "DisplayTickCount",
    "DisplayFormat",
    "DecimalPoints",
    "Color",
    "Alias",
    "PltLogX",
    "PltLogY",
    "FftLogX",
    "FftBallistics",
    "FftBallisticsRelease",
    "ExtremeHold",
    "SuppressAlarms",
    "AlarmDeadband",
    "AlarmsWhileVisible"
  ],
  "struct": {
    "type": "DataModel::Dataset",
    "header": "DataModel/Frame.h",
    "variable": "d"
  },
  "notes": [
    "Transcribed from the hand-written surfaces, not re-derived: serialize()/read() in Frame.h/Frame.cpp, the dataset row builders in ProjectEditorForms.cpp, the commit sub-appliers in ProjectEditorCommit.cpp, and applyDataset*Fields in ProjectHandlerEntities.cpp.",
    "jsonKey names a Keys:: constant identifier; the literal spelling lives only in Frame.h.",
    "Two declared defect fixes carry a 'defect' marker and describe the TARGET state, not today's behaviour: overviewDisplay is now serialized, and the read-side defaults for fftSamples/fftSamplingRate/ledHigh/index match the struct initializers.",
    "value and numericValue are runtime values that today's serializer still writes into the document; they stay persist:always so project files round-trip byte-identically."
  ],
  "optionSources": {
    "datasetWidgets": {
      "kind": "extensibleMap",
      "valueType": "string",
      "translate": "ProjectEditor",
      "notFoundIndex": 0,
      "hook": "widgetExtensionOptions",
      "notes": "Order is QMap key order (m_datasetWidgets), not insertion order. Installed dataset-scope widget extension packages (spec 0038) are appended after these rows, so a machine with no package installed sees exactly this domain and no stored index moves.",
      "entries": [
        {
          "value": "",
          "label": "None",
          "translated": true
        },
        {
          "value": "bar",
          "label": "Bar",
          "translated": true
        },
        {
          "value": "compass",
          "label": "Compass",
          "translated": true
        },
        {
          "value": "gauge",
          "label": "Gauge",
          "translated": true
        },
        {
          "value": "meter",
          "label": "Meter",
          "translated": true
        }
      ]
    },
    "displayFormats": {
      "kind": "staticMap",
      "valueType": "string",
      "translate": "ProjectEditor",
      "notFoundIndex": 0,
      "notes": "Order is QMap key order (m_displayFormats).",
      "entries": [
        {
          "value": "",
          "label": "Auto",
          "translated": true
        },
        {
          "value": "0d",
          "label": "Integer (0 decimals)",
          "translated": true
        },
        {
          "value": "1d",
          "label": "1 decimal",
          "translated": true
        },
        {
          "value": "2d",
          "label": "2 decimals",
          "translated": true
        },
        {
          "value": "3d",
          "label": "3 decimals",
          "translated": true
        },
        {
          "value": "sci",
          "label": "Scientific",
          "translated": true
        }
      ]
    },
    "plotOptions": {
      "kind": "tuple",
      "valueType": "boolPair",
      "translate": "ProjectEditor",
      "notFoundIndex": 0,
      "fields": [
        "Plt",
        "Log"
      ],
      "notes": "Order is QMap key order (m_plotOptions, keyed by QPair<plt,log>).",
      "entries": [
        {
          "values": [
            false,
            false
          ],
          "label": "No",
          "translated": true
        },
        {
          "values": [
            true,
            false
          ],
          "label": "Yes",
          "translated": true
        }
      ]
    },
    "fftSampleCounts": {
      "kind": "parallelValues",
      "valueType": "int",
      "notFoundIndex": 7,
      "notes": "m_fftSamples; labels are the numbers themselves and are never translated. Not-found falls back to index 7 (1024).",
      "entries": [
        {
          "value": 8,
          "label": "8"
        },
        {
          "value": 16,
          "label": "16"
        },
        {
          "value": 32,
          "label": "32"
        },
        {
          "value": 64,
          "label": "64"
        },
        {
          "value": 128,
          "label": "128"
        },
        {
          "value": 256,
          "label": "256"
        },
        {
          "value": 512,
          "label": "512"
        },
        {
          "value": 1024,
          "label": "1024"
        },
        {
          "value": 2048,
          "label": "2048"
        },
        {
          "value": 4096,
          "label": "4096"
        },
        {
          "value": 8192,
          "label": "8192"
        },
        {
          "value": 16384,
          "label": "16384"
        },
        {
          "value": 32768,
          "label": "32768"
        },
        {
          "value": 65536,
          "label": "65536"
        },
        {
          "value": 131072,
          "label": "131072"
        },
        {
          "value": 262144,
          "label": "262144"
        }
      ]
    },
    "fftWindows": {
      "kind": "parallelValues",
      "valueType": "int",
      "translate": "ProjectEditor",
      "notFoundIndex": 5,
      "notes": "m_fftWindows / m_fftWindowValues; values are SerialStudio::FFTWindow. Not-found falls back to Blackman-Harris (5).",
      "entries": [
        {
          "value": 0,
          "label": "Rectangular (None)",
          "translated": true
        },
        {
          "value": 1,
          "label": "Bartlett (Triangular)",
          "translated": true
        },
        {
          "value": 2,
          "label": "Hann",
          "translated": true
        },
        {
          "value": 3,
          "label": "Hamming",
          "translated": true
        },
        {
          "value": 4,
          "label": "Blackman",
          "translated": true
        },
        {
          "value": 5,
          "label": "Blackman-Harris",
          "translated": true
        },
        {
          "value": 6,
          "label": "Nuttall",
          "translated": true
        },
        {
          "value": 7,
          "label": "Blackman-Nuttall",
          "translated": true
        },
        {
          "value": 8,
          "label": "Flat Top",
          "translated": true
        },
        {
          "value": 9,
          "label": "Welch",
          "translated": true
        },
        {
          "value": 10,
          "label": "Bartlett-Hann",
          "translated": true
        },
        {
          "value": 11,
          "label": "Bohman",
          "translated": true
        },
        {
          "value": 12,
          "label": "Cosine (Sine)",
          "translated": true
        },
        {
          "value": 13,
          "label": "Lanczos",
          "translated": true
        },
        {
          "value": 14,
          "label": "Parzen",
          "translated": true
        }
      ]
    },
    "xAxisSources": {
      "kind": "liveProvider",
      "valueType": "int",
      "notFoundIndex": 0,
      "notFoundValue": -2,
      "labelProvider": "xDataSources",
      "valueProvider": "xDataSourceUniqueIds",
      "notes": "ProjectModel-computed; not-found stores kXAxisTime (-2)."
    },
    "waterfallYSources": {
      "kind": "liveProvider",
      "valueType": "int",
      "notFoundIndex": 0,
      "notFoundValue": 0,
      "labelProvider": "yWaterfallSources",
      "valueProvider": "yWaterfallSourceUniqueIds",
      "notes": "ProjectModel-computed; not-found stores 0 (Time)."
    }
  },
  "hooks": {
    "widgetExtensionOptions": {
      "kind": "optionProvider",
      "signature": "QList<QPair<QString, QString>> widgetExtensionOptions()",
      "origin": "PropertyHooks.cpp:widgetExtensionOptions",
      "notes": "Appends the installed dataset-scope widget extension packages to the built-in widget domain (spec 0038 T20 residue); a package that replaces a built-in keeps the built-in row."
    },
    "aliasUnique": {
      "kind": "validator",
      "signature": "bool aliasInUseByOtherDataset(const DataModel::ProjectModel& pm, const QString& alias, int selfUniqueId)",
      "origin": "ProjectEditorCommit.cpp:datasetAliasInUse / ProjectHandlerEntities.cpp:aliasInUseByOtherDataset"
    },
    "colorValid": {
      "kind": "validator",
      "signature": "bool isValidColor(const QString& color)",
      "origin": "Frame.cpp:read(Dataset) / ProjectHandlerEntities.cpp:applyDatasetTextAndToggleFields"
    },
    "indexNonNegative": {
      "kind": "validator",
      "signature": "bool isValidDatasetIndex(int index)",
      "origin": "ProjectHandlerEntities.cpp:applyDatasetNumericFields"
    },
    "fftWindowRange": {
      "kind": "validator",
      "signature": "bool isValidFftWindow(int window)",
      "origin": "Frame.cpp:read(Dataset) / ProjectHandlerEntities.cpp:applyDatasetNumericFields"
    },
    "transformLanguageDomain": {
      "kind": "validator",
      "signature": "bool isValidTransformLanguage(int language)",
      "origin": "ProjectHandlerEntities.cpp:applyDatasetDisplayAndTransformFields"
    },
    "deadbandNonNegative": {
      "kind": "validator",
      "signature": "bool isValidAlarmDeadband(double deadband)",
      "origin": "PropertyValidators.cpp:isValidAlarmDeadband (alarm deadband, 2026-10)"
    },
    "insidePainterGroup": {
      "kind": "predicate",